{
  "schemaVersion": "avatar-asset-manifest-v1",
  "assetSetVersion": "pixel-layers-v3",
  "phase": "pilot",
  "catalogVersion": "pixel-parts-v1",
  "canvas": {
    "width": 256,
    "height": 384,
    "logicalWidth": 128,
    "logicalHeight": 192,
    "exportScale": 2,
    "pixelInterpolation": "nearest",
    "safeBounds": { "x": 8, "y": 4, "width": 244, "height": 376 },
    "baselineY": 380,
    "faceSafeArea": { "x": 118, "y": 168, "width": 30, "height": 5 },
    "torsoArea": { "x": 82, "y": 168, "width": 92, "height": 130 },
    "anchors": {
      "leftHand": { "x": 62, "y": 240 },
      "rightHand": { "x": 194, "y": 240 },
      "leftGround": { "x": 6, "y": 354 },
      "rightGround": { "x": 250, "y": 354 }
    }
  },
  "layerOrder": ["hairBack", "body", "outfit", "faceFeatures", "hairFront", "item", "accent"],
  "fallback": {
    "path": "/avatar-parts/v3/fallback-default.png",
    "sha256": "8b88eaf625b49bfcbb9ad5197879828578fbc2da8cec5e7c04f518e8a75139d6",
    "provenanceId": "universal-lpc"
  },
  "parts": {
    "body": {
      "light": {
        "id": "light", "role": "body",
        "layers": { "body": { "path": "/avatar-parts/v3/body-light.png", "sha256": "a52f703210bd2d1bc4362bffdde790b5c052661bdff5a66c2f45e2e531af75cd", "provenanceId": "universal-lpc" } },
        "contentBounds": { "x": 53, "y": 103, "width": 150, "height": 235 }, "anchor": null, "provenanceId": "universal-lpc",
        "variants": [
          { "id": "light-green", "layers": { "body": { "path": "/avatar-parts/v3/body-light-green.png", "sha256": "f8734958127c0ac23e779360995039fbed173ea7a846b0fc25ec5690112d1f52", "provenanceId": "universal-lpc" } }, "contentBounds": { "x": 53, "y": 103, "width": 150, "height": 235 }, "provenanceId": "universal-lpc" },
          { "id": "light-brown", "layers": { "body": { "path": "/avatar-parts/v3/body-light-brown.png", "sha256": "cd5b56d01167df5c52e6d75fcd15c245af66b265c3ce077af486ea09bae3a355", "provenanceId": "universal-lpc" } }, "contentBounds": { "x": 53, "y": 103, "width": 150, "height": 235 }, "provenanceId": "universal-lpc" }
        ]
      },
      "warm": {
        "id": "warm", "role": "body",
        "layers": { "body": { "path": "/avatar-parts/v3/body-warm.png", "sha256": "10df7653c61d3ac7288e011fc25550a7db20545ca80b779db284f578d1a939f1", "provenanceId": "universal-lpc" } },
        "contentBounds": { "x": 53, "y": 103, "width": 150, "height": 235 }, "anchor": null, "provenanceId": "universal-lpc",
        "variants": [
          { "id": "warm-brown", "layers": { "body": { "path": "/avatar-parts/v3/body-warm-brown.png", "sha256": "fc7ab8e9ee73b1d9c370dcf0ecf2d0cfe2e5e28093d4d48c8077ff70bb2fa550", "provenanceId": "universal-lpc" } }, "contentBounds": { "x": 53, "y": 103, "width": 150, "height": 235 }, "provenanceId": "universal-lpc" },
          { "id": "warm-gray", "layers": { "body": { "path": "/avatar-parts/v3/body-warm-gray.png", "sha256": "359754922f0a40dd0d60e051882da4c77d8873b6caab57643f89f8b7dc4a781d", "provenanceId": "universal-lpc" } }, "contentBounds": { "x": 53, "y": 103, "width": 150, "height": 235 }, "provenanceId": "universal-lpc" }
        ]
      },
      "deep": {
        "id": "deep", "role": "body",
        "layers": { "body": { "path": "/avatar-parts/v3/body-deep.png", "sha256": "08e29b2f55b668ef9e1b389304ba5a3cac2f7c03e38763e868c5dba63d7d1ef5", "provenanceId": "universal-lpc" } },
        "contentBounds": { "x": 53, "y": 103, "width": 150, "height": 235 }, "anchor": null, "provenanceId": "universal-lpc",
        "variants": [
          { "id": "deep-blue", "layers": { "body": { "path": "/avatar-parts/v3/body-deep-blue.png", "sha256": "90a9b1d74203f9cf0e15cc51507e4de58d37a99004c142a4246531568f11254d", "provenanceId": "universal-lpc" } }, "contentBounds": { "x": 53, "y": 103, "width": 150, "height": 235 }, "provenanceId": "universal-lpc" },
          { "id": "deep-green", "layers": { "body": { "path": "/avatar-parts/v3/body-deep-green.png", "sha256": "278964ba61b42861d4294733c8b123d7a28f19c6203cce9a7b9f64ee00977eff", "provenanceId": "universal-lpc" } }, "contentBounds": { "x": 53, "y": 103, "width": 150, "height": 235 }, "provenanceId": "universal-lpc" }
        ]
      }
    },
    "hair": {
      "short": {
        "id": "short", "role": "hair",
        "layers": {
          "hairBack": { "path": "/avatar-parts/v3/hair-short-back.png", "sha256": "00a7cbcbc9beec6e795033fa61663909543047fc9e4497950de43b9a964407cb", "provenanceId": "universal-lpc" },
          "hairFront": { "path": "/avatar-parts/v3/hair-short-front.png", "sha256": "2f6499c2199482ddd5ac3f787139228c19dfc71a10b35f6fbf163da8cc5964aa", "provenanceId": "universal-lpc" }
        },
        "contentBounds": { "x": 73, "y": 98, "width": 110, "height": 95 }, "anchor": null, "provenanceId": "universal-lpc",
        "variants": [
          { "id": "short-curtains", "layers": { "hairBack": { "path": "/avatar-parts/v3/hair-short-curtains-back.png", "sha256": "00a7cbcbc9beec6e795033fa61663909543047fc9e4497950de43b9a964407cb", "provenanceId": "universal-lpc" }, "hairFront": { "path": "/avatar-parts/v3/hair-short-curtains-front.png", "sha256": "16a5fb62a8ae158596ab5db82af61fe2ee18f0ec1e8438e4ea4d3f08e95c903a", "provenanceId": "universal-lpc" } }, "contentBounds": { "x": 68, "y": 98, "width": 120, "height": 75 }, "provenanceId": "universal-lpc" },
          { "id": "short-pixie", "layers": { "hairBack": { "path": "/avatar-parts/v3/hair-short-pixie-back.png", "sha256": "00a7cbcbc9beec6e795033fa61663909543047fc9e4497950de43b9a964407cb", "provenanceId": "universal-lpc" }, "hairFront": { "path": "/avatar-parts/v3/hair-short-pixie-front.png", "sha256": "4de17988e8df1649dbc09eac3ff1dbebd5327bbfc98cf5a654a15b8c5860dcf8", "provenanceId": "universal-lpc" } }, "contentBounds": { "x": 63, "y": 98, "width": 120, "height": 105 }, "provenanceId": "universal-lpc" }
        ]
      },
      "wave": {
        "id": "wave", "role": "hair",
        "layers": {
          "hairBack": { "path": "/avatar-parts/v3/hair-wave-back.png", "sha256": "00a7cbcbc9beec6e795033fa61663909543047fc9e4497950de43b9a964407cb", "provenanceId": "universal-lpc" },
          "hairFront": { "path": "/avatar-parts/v3/hair-wave-front.png", "sha256": "072b5da8f9da4aa349c092d49306922649cf4d8db8913c74f80b393c24c35627", "provenanceId": "universal-lpc" }
        },
        "contentBounds": { "x": 68, "y": 88, "width": 125, "height": 110 }, "anchor": null, "provenanceId": "universal-lpc",
        "variants": [
          { "id": "wave-long", "layers": { "hairBack": { "path": "/avatar-parts/v3/hair-wave-long-back.png", "sha256": "00a7cbcbc9beec6e795033fa61663909543047fc9e4497950de43b9a964407cb", "provenanceId": "universal-lpc" }, "hairFront": { "path": "/avatar-parts/v3/hair-wave-long-front.png", "sha256": "c9736e5c6964f46875e0e8e975e870d7a8cc7b88e06412d10acb2af5ce2f7fd2", "provenanceId": "universal-lpc" } }, "contentBounds": { "x": 68, "y": 98, "width": 120, "height": 115 }, "provenanceId": "universal-lpc" },
          { "id": "wave-curly", "layers": { "hairBack": { "path": "/avatar-parts/v3/hair-wave-curly-back.png", "sha256": "00a7cbcbc9beec6e795033fa61663909543047fc9e4497950de43b9a964407cb", "provenanceId": "universal-lpc" }, "hairFront": { "path": "/avatar-parts/v3/hair-wave-curly-front.png", "sha256": "6aef1439ba06a722e6db14191bc88b34b80a70c6d31c12a30f7608dbc22a2d0b", "provenanceId": "universal-lpc" } }, "contentBounds": { "x": 43, "y": 93, "width": 155, "height": 145 }, "provenanceId": "universal-lpc" }
        ]
      },
      "bob": {
        "id": "bob", "role": "hair",
        "layers": {
          "hairBack": { "path": "/avatar-parts/v3/hair-bob-back.png", "sha256": "00a7cbcbc9beec6e795033fa61663909543047fc9e4497950de43b9a964407cb", "provenanceId": "universal-lpc" },
          "hairFront": { "path": "/avatar-parts/v3/hair-bob-front.png", "sha256": "b70a437995c3e12643cfcd509815fd18543214f784b20eae6d25ddfd43f1d5db", "provenanceId": "universal-lpc" }
        },
        "contentBounds": { "x": 63, "y": 103, "width": 130, "height": 100 }, "anchor": null, "provenanceId": "universal-lpc",
        "variants": [
          { "id": "bob-lob", "layers": { "hairBack": { "path": "/avatar-parts/v3/hair-bob-lob-back.png", "sha256": "00a7cbcbc9beec6e795033fa61663909543047fc9e4497950de43b9a964407cb", "provenanceId": "universal-lpc" }, "hairFront": { "path": "/avatar-parts/v3/hair-bob-lob-front.png", "sha256": "977d3915dcd10b48221a607ee51b8f8a9fbc1470e1468749f8433d72ac633420", "provenanceId": "universal-lpc" } }, "contentBounds": { "x": 63, "y": 103, "width": 130, "height": 115 }, "provenanceId": "universal-lpc" },
          { "id": "bob-page", "layers": { "hairBack": { "path": "/avatar-parts/v3/hair-bob-page-back.png", "sha256": "00a7cbcbc9beec6e795033fa61663909543047fc9e4497950de43b9a964407cb", "provenanceId": "universal-lpc" }, "hairFront": { "path": "/avatar-parts/v3/hair-bob-page-front.png", "sha256": "15497bf6dead5a625ef1183f5fbdb56aac975108e3c5472de3e0b9dd5b4b8993", "provenanceId": "universal-lpc" } }, "contentBounds": { "x": 73, "y": 103, "width": 110, "height": 90 }, "provenanceId": "universal-lpc" }
        ]
      },
      "spike": {
        "id": "spike", "role": "hair",
        "layers": {
          "hairBack": { "path": "/avatar-parts/v3/hair-spike-back.png", "sha256": "00a7cbcbc9beec6e795033fa61663909543047fc9e4497950de43b9a964407cb", "provenanceId": "universal-lpc" },
          "hairFront": { "path": "/avatar-parts/v3/hair-spike-front.png", "sha256": "e099f6f2d9ec7e701842fe3e692b8be1c50971f15baad924aae10e0adc29f11f", "provenanceId": "universal-lpc" }
        },
        "contentBounds": { "x": 78, "y": 78, "width": 110, "height": 85 }, "anchor": null, "provenanceId": "universal-lpc",
        "variants": [